{"family_id":"BL_ICF_V1","family_version":"1.0.0","kernel_schema_version":"recclaw.mechanism-space.kernel.v1","profile_ref":{"profile_digest":"1111111111111111111111111111111111111111111111111111111111111111","profile_id":"recclaw.dev-profile.offline-topn.ml1m.fixture.v1","profile_kind":"OFFLINE_TOPN"},"program_payload":{"ablation_plan":[{"ablation_id":"remove_core_mechanism","expected_observation":"The expected anchor signature is no longer present after removing the core mechanism.","remove_component_ids":["ssl_objective"]}],"architecture_operators":[],"changed_slots":[{"change_role":"CORE","slot_id":"SELF_SUPERVISION"},{"change_role":"SUPPORT","slot_id":"RELATION_VIEW"}],"claim_ceiling":"DEVELOPMENT_ONLY_SINGLE_PROTOCOL_NO_GENERAL_CLAIM","components":[{"component_id":"ui_graph","inputs":[{"port":"source","source":{"data_role":"TRAIN_INTERACTIONS","kind":"DATA"}}],"parameters":{},"primitive_id":"relation.user_item_bipartite","slot_id":"RELATION_VIEW"},{"component_id":"embedding","inputs":[{"port":"identity","source":{"data_role":"USER_ID","kind":"DATA"}},{"port":"identity","source":{"data_role":"ITEM_ID","kind":"DATA"}}],"parameters":{"dimension":64},"primitive_id":"embedding.independent_user_item","slot_id":"EMBEDDING"},{"component_id":"encoder","inputs":[{"port":"representation","source":{"component_id":"embedding","kind":"COMPONENT","output_port":"embedding"}},{"port":"relation","source":{"component_id":"ui_graph","kind":"COMPONENT","output_port":"relation"}}],"parameters":{},"primitive_id":"encoder.explicit_message_passing","slot_id":"ENCODER"},{"component_id":"message","inputs":[{"port":"representation","source":{"component_id":"encoder","kind":"COMPONENT","output_port":"representation"}},{"port":"relation","source":{"component_id":"ui_graph","kind":"COMPONENT","output_port":"relation"}}],"parameters":{},"primitive_id":"message.identity","slot_id":"MESSAGE"},{"component_id":"propagation","inputs":[{"port":"signal","source":{"component_id":"message","kind":"COMPONENT","output_port":"message"}},{"port":"relation","source":{"component_id":"ui_graph","kind":"COMPONENT","output_port":"relation"}}],"parameters":{"depth":3},"primitive_id":"propagation.symmetric_normalization","slot_id":"PROPAGATION_AGGREGATION"},{"component_id":"fusion","inputs":[{"port":"branch","source":{"component_id":"encoder","kind":"COMPONENT","output_port":"representation"}},{"port":"branch","source":{"component_id":"propagation","kind":"COMPONENT","output_port":"representation"}}],"parameters":{},"primitive_id":"fusion.layer_weighted_sum","slot_id":"FUSION_ROUTING"},{"component_id":"score","inputs":[{"port":"representation","source":{"component_id":"fusion","kind":"COMPONENT","output_port":"representation"}}],"parameters":{},"primitive_id":"score.dot_product","slot_id":"SCORE_HEAD"},{"component_id":"edge_view","inputs":[{"port":"signal","source":{"component_id":"ui_graph","kind":"COMPONENT","output_port":"relation"}}],"parameters":{},"primitive_id":"ssl.view.edge_dropout","slot_id":"SELF_SUPERVISION"},{"component_id":"ssl_objective","inputs":[{"port":"views","source":{"component_id":"fusion","kind":"COMPONENT","output_port":"representation"}},{"port":"views","source":{"component_id":"edge_view","kind":"COMPONENT","output_port":"view"}}],"parameters":{"temperature":0.2,"weight":0.1},"primitive_id":"ssl.objective.info_nce","slot_id":"SELF_SUPERVISION"},{"component_id":"sampler","inputs":[{"port":"interactions","source":{"data_role":"TRAIN_INTERACTIONS","kind":"DATA"}}],"parameters":{"false_negative_policy":"ALLOW_UNKNOWN","hardness":"NONE","negative_count":1,"purpose":["RANKING_SIGNAL"],"refresh_frequency":"BATCH","replacement":true},"primitive_id":"sampler.uniform","slot_id":"NEGATIVE_SAMPLER"},{"component_id":"objective","inputs":[{"port":"score","source":{"component_id":"score","kind":"COMPONENT","output_port":"score"}},{"port":"supervision","source":{"data_role":"TRAIN_INTERACTIONS","kind":"DATA"}},{"port":"negative_samples","source":{"component_id":"sampler","kind":"COMPONENT","output_port":"negative_samples"}}],"parameters":{},"primitive_id":"objective.bpr","slot_id":"PRIMARY_OBJECTIVE"},{"component_id":"training","inputs":[{"port":"objective","source":{"component_id":"objective","kind":"COMPONENT","output_port":"objective"}},{"port":"objective","source":{"component_id":"ssl_objective","kind":"COMPONENT","output_port":"auxiliary_objective"}}],"parameters":{"learning_rate":0.001},"primitive_id":"training.adam","slot_id":"TRAINING_PROCEDURE"}],"construction_mode":"COMPOSITION","core_hypothesis":"On ML-1M with frozen full-sort evaluation, a LightGCN-style backbone paired with pairwise ranking plus a lightweight contrastive auxiliary over two stochastically edge-dropped graph views will expose whether better invariance in sparse collaborative structure can lift top-k quality beyond the weak baseline without incu","custom_components":[],"estimated_cost":{"precompute_required":false,"relative_memory":"LOW","relative_training_compute":"LOW"},"expected_effects":{"coverage":"development Canary only","efficiency":"Auxiliary contrastive alignment between two degree-perturbed graph views should improve representation uniformity for sparse users/items while preserving the strong runnable baseline, yielding a small","relevance":"Auxiliary contrastive alignment between two degree-perturbed graph views should improve representation uniformity for sparse users/items while preserving the strong runnable baseline, yielding a small","robustness":"Contrastive auxiliary may over-regularize embeddings and wash out ranking-specific signal, especially if perturbation removes too much collaborative structure, causing flat or negative NDCG movement."},"failure_modes":["Contrastive auxiliary may over-regularize embeddings and wash out ranking-specific signal, especially if perturbation removes too much collaborative structure, causing flat or negative NDCG movement."],"family_contract_id":"BL_ICF_V1","implementation_plan":["Compile the fixture into resolved mechanism IR and compare its structural signature."],"input_semantics":{"external_features":false,"item_id":true,"train_interactions":true,"user_id":true},"matched_control":{"control_ref":"TEST_ONLY_ANCHOR_CONTROL","rationale":"The fixture checks semantic expression against an independently declared anchor signature."},"mechanism_explanation":"lgp_contrastive_hardview_degreeaware: Auxiliary contrastive alignment between two degree-perturbed graph views should improve representation uniformity for sparse users/items while preserving the strong runnable baseline, yielding a small","parent_refs":[],"protocol_impact":{"requested_changes":[],"status":"UNCHANGED"},"removed_slots":[],"research_question":"On ML-1M with frozen full-sort evaluation, a LightGCN-style backbone paired with pairwise ranking plus a lightweight contrastive auxiliary over two stochastically edge-dropped graph views will expose whether better invariance in sparse collaborative structure can lift top-k quality beyond the weak baseline without incu","schema_version":"recclaw.bl-icf.mechanism-program.v1"},"record_type":"MECHANISM_PROGRAM_ENVELOPE","search_space_digest":"782c5a0d743c014a7b8a5312f96a7fa8e558429454bfdf2c25c42ae77fe7d4a4","search_space_id":"BL_ICF_MECHANISM_SPACE_V1"}